{"$schema":"https://json-schema.org/draft/2020-12/schema","title":"Actor v3","type":"object","required":["schemaVersion","id","enemyId","parts"],"properties":{"schemaVersion":{"const":3},"id":{"type":"string","minLength":1},"enemyId":{"type":"string"},"tags":{"type":"array","items":{"type":"string"}},"parts":{"type":"array","items":{"type":"object","required":["id"],"properties":{"id":{"type":"string"},"parentPartId":{"type":["string","null"]},"offsetX":{"type":"number"},"offsetY":{"type":"number"},"rotationDegrees":{"type":"number"},"healthPolicy":{"type":"string"},"hurtboxes":{"type":"array"},"hardpoints":{"type":"array"}}}}}}
